{
  "schema_version": 1,
  "id": "mille-bsd",
  "title": "Mille Bornes",
  "summary": "The French car-racing card game: race to 1000 miles while stopping your rival.",
  "description": "Play mileage, hazards, remedies and safeties against the computer. Keys: p picks up, u uses a card, d discards, then the card's number.",
  "category": "cards",
  "tags": [
    "cards",
    "racing",
    "classic"
  ],
  "players": "1",
  "origin": "verified_port",
  "upstream": {
    "authors": [
      "Ken Arnold"
    ],
    "license": "BSD-3-Clause",
    "source_url": "https://salsa.debian.org/debian/bsdgames",
    "version": "2.17 (Debian 2.17-33)"
  },
  "port": {
    "maintainer": "Tuikio ports team",
    "recipe": "native/recipes/bsdgames.py",
    "source_archive": "bsdgames_2.17.orig.tar.gz",
    "source_sha256": "066f924aef6c1c5ea946f588e36f303021f5dfc093944738f025d8edbc6fff60",
    "license_file": "bsdgames.txt"
  },
  "runtime": {
    "backend": "native_pty",
    "executable": "game_mille_bsd",
    "args": [],
    "env": {},
    "terminal": {
      "min": [
        80,
        24
      ],
      "preferred": [
        80,
        24
      ]
    },
    "orientation": "landscape"
  },
  "controls": "text.v1",
  "control_hide": [
    "space"
  ],
  "keys": [
    {
      "label": "Pick",
      "text": "p"
    },
    {
      "label": "Use",
      "text": "u"
    },
    {
      "label": "Discard",
      "text": "d"
    },
    {
      "label": "1",
      "text": "1"
    },
    {
      "label": "2",
      "text": "2"
    },
    {
      "label": "3",
      "text": "3"
    },
    {
      "label": "4",
      "text": "4"
    },
    {
      "label": "5",
      "text": "5"
    },
    {
      "label": "6",
      "text": "6"
    }
  ],
  "saves": {
    "paths": [],
    "notes": "No saves."
  },
  "data_files": [],
  "network": "none",
  "status": "PORTABLE",
  "verification": {
    "host_tested": "2026-10-23",
    "android_tested": null,
    "notes": "Host test: hand and score table."
  }
}
