{
  "schema_version": 1,
  "id": "snakeduel-nb",
  "title": "Snake Duel",
  "summary": "Two snakes, one arena: make the computer's snake crash first.",
  "description": "Change direction with the pad. Whoever runs into a wall or a tail loses the round.",
  "category": "arcade",
  "tags": [
    "snake",
    "versus"
  ],
  "players": "1",
  "origin": "verified_port",
  "upstream": {
    "authors": [
      "abakh"
    ],
    "license": "CC0-1.0 OR Apache-2.0",
    "source_url": "https://github.com/abakh/nbsdgames",
    "version": "git d9494d5 (2026-10-20)"
  },
  "port": {
    "maintainer": "Tuikio ports team",
    "recipe": "native/recipes/nbsdgames.py",
    "source_archive": "nbsdgames-d9494d50.tar",
    "source_sha256": "79e6e8aef92c2a99cdeed9ebe78ddba46b360212733762060320503ef6c4c9ba",
    "license_file": "nbsdgames.txt"
  },
  "runtime": {
    "backend": "native_pty",
    "executable": "game_snakeduel_nb",
    "args": [],
    "env": {},
    "terminal": {
      "min": [
        40,
        16
      ],
      "preferred": [
        80,
        24
      ]
    },
    "orientation": "landscape"
  },
  "controls": "nbsd.v1",
  "control_hide": [
    "select",
    "space"
  ],
  "keys": [
    {
      "label": "Quit",
      "text": "q"
    }
  ],
  "saves": {
    "paths": [],
    "notes": "No saves."
  },
  "data_files": [],
  "network": "none",
  "status": "PORTABLE",
  "verification": {
    "host_tested": "2026-10-23",
    "android_tested": null,
    "notes": "Host test: arena and win counters."
  }
}
