{
  "schema_version": 1,
  "id": "reversi-nb",
  "title": "Reversi",
  "summary": "Othello against the computer or a friend.",
  "description": "Choose who plays each side (H for human, c for computer), then place pieces with the pad and Enter or by tapping. Outflank to flip.",
  "category": "strategy",
  "tags": [
    "board",
    "two player",
    "classic"
  ],
  "players": "1-2",
  "origin": "verified_port",
  "upstream": {
    "authors": [
      "abakh"
    ],
    "license": "CC0-1.0 OR Apache-2.0",
    "source_url": "https://github.com/abakh/nbsdgames",
    "version": "git d9494d5 (2026-10-20)"
  },
  "port": {
    "maintainer": "Tuikio ports team",
    "recipe": "native/recipes/nbsdgames.py",
    "source_archive": "nbsdgames-d9494d50.tar",
    "source_sha256": "79e6e8aef92c2a99cdeed9ebe78ddba46b360212733762060320503ef6c4c9ba",
    "license_file": "nbsdgames.txt"
  },
  "runtime": {
    "backend": "native_pty",
    "executable": "game_reversi_nb",
    "args": [],
    "env": {},
    "terminal": {
      "min": [
        40,
        16
      ],
      "preferred": [
        80,
        24
      ]
    },
    "orientation": "landscape"
  },
  "controls": "nbsd.v1",
  "saves": {
    "paths": [],
    "notes": "No saves."
  },
  "data_files": [],
  "network": "none",
  "status": "PORTABLE",
  "verification": {
    "host_tested": "2026-10-23",
    "android_tested": null,
    "notes": "Host test: player setup prompt."
  }
}
