{
  "schema_version": 1,
  "id": "worm-bsd",
  "title": "Worm",
  "summary": "The original growing-worm game: eat the numbers, don't hit yourself.",
  "description": "Steer with the pad; each number you eat makes the worm that much longer.",
  "category": "arcade",
  "tags": [
    "snake",
    "classic"
  ],
  "players": "1",
  "origin": "verified_port",
  "upstream": {
    "authors": [
      "Michael Toy"
    ],
    "license": "BSD-3-Clause",
    "source_url": "https://salsa.debian.org/debian/bsdgames",
    "version": "2.17 (Debian 2.17-33)"
  },
  "port": {
    "maintainer": "Tuikio ports team",
    "recipe": "native/recipes/bsdgames.py",
    "source_archive": "bsdgames_2.17.orig.tar.gz",
    "source_sha256": "066f924aef6c1c5ea946f588e36f303021f5dfc093944738f025d8edbc6fff60",
    "license_file": "bsdgames.txt"
  },
  "runtime": {
    "backend": "native_pty",
    "executable": "game_worm_bsd",
    "args": [],
    "env": {},
    "terminal": {
      "min": [
        80,
        24
      ],
      "preferred": [
        80,
        24
      ]
    },
    "orientation": "landscape"
  },
  "controls": "arrows.v1",
  "control_hide": [
    "select",
    "space",
    "back"
  ],
  "saves": {
    "paths": [],
    "notes": "No saves."
  },
  "data_files": [],
  "network": "none",
  "status": "PORTABLE",
  "verification": {
    "host_tested": "2026-10-23",
    "android_tested": null,
    "notes": "Host test: field and worm."
  }
}
